{
  "project_id": "2015A1",
  "model_id": "qwen2.5:14b-instruct",
  "prompt_version": "v2",
  "input_hash": "290bd0c936333dc0c927ac50",
  "input_source": "metadata_only",
  "generated_at": "2026-04-26T15:13:05+00:00",
  "verdict": {
    "primary_term": "E-learning",
    "secondary_term": null,
    "confidence": 0.95,
    "justification": "The project focuses on developing an educational software tool using a Learning Management System (LMS) and Objectives Virtual of Learning (OVA) for teaching English in the tenth grade.",
    "keywords_cited": [
      "Objetos Virtuales de Aprendizaje",
      "Sistema de Gestión de Aprendizaje",
      "Inglés",
      "Aprendizaje y enseñanza de idiomas"
    ]
  }
}