{
  "project_id": "2020S16",
  "model_id": "qwen2.5:14b-instruct",
  "prompt_version": "v2",
  "input_hash": "0f40c40b356049b50f28553b",
  "input_source": "metadata_only",
  "generated_at": "2026-04-25T17:14:26+00:00",
  "verdict": {
    "primary_term": "Recommender systems",
    "secondary_term": null,
    "confidence": 0.8,
    "justification": "The project focuses on developing a recommendation system for swimming training using machine learning techniques.",
    "keywords_cited": [
      "IA",
      "machine learning",
      "recomendación"
    ]
  }
}