{
  "project_id": "2025S19",
  "model_id": "qwen2.5:14b-instruct",
  "prompt_version": "v2",
  "input_hash": "d77fa5948836050e5e38d937",
  "input_source": "metadata_only",
  "generated_at": "2026-04-25T17:26:06+00:00",
  "verdict": {
    "primary_term": "Mobile applications",
    "secondary_term": "Recommender systems",
    "confidence": 0.8,
    "justification": "The project focuses on developing a mobile application for finding and offering tutoring services, which includes a recommendation system to match users with suitable tutors.",
    "keywords_cited": [
      "Tutoría",
      "API",
      "Redes Sociales",
      "aplicaciones"
    ]
  }
}