{
  "project_id": "2020S02",
  "model_id": "llama3.1:8b",
  "prompt_version": "v2",
  "input_hash": "9f74ce0386f943698f6f8c35",
  "input_source": "metadata_only",
  "generated_at": "2026-04-26T16:41:36+00:00",
  "verdict": {
    "primary_term": "E-learning",
    "secondary_term": null,
    "confidence": 0.9,
    "justification": "The project involves designing and implementing two virtual learning objects (OVAs) to support the course of Computer Architecture I at Universidad del Valle Sede Tuluá, using gamification techniques to facilitate student learning.",
    "keywords_cited": [
      "E-learning",
      "gamificación"
    ]
  }
}