{
  "project_id": "2021S03",
  "model_id": "qwen2.5:14b-instruct",
  "prompt_version": "v2",
  "input_hash": "d6195c4555c3cbf1bc8a6c9d",
  "input_source": "metadata_only",
  "generated_at": "2026-04-25T17:15:29+00:00",
  "verdict": {
    "primary_term": "Recommender systems",
    "secondary_term": null,
    "confidence": 0.9,
    "justification": "The project focuses on developing a recommendation system for organizing football matches using matchmaking techniques and AI.",
    "keywords_cited": [
      "Matchmaking",
      "desarrollo de software",
      "IA"
    ]
  }
}