{
  "project_id": "2024S06",
  "model_id": "qwen2.5:14b-instruct",
  "prompt_version": "v2",
  "input_hash": "236aeabdeffb929d7e490f9a",
  "input_source": "metadata_only",
  "generated_at": "2026-04-25T17:23:15+00:00",
  "verdict": {
    "primary_term": "Gamification",
    "secondary_term": null,
    "confidence": 0.9,
    "justification": "The project focuses on developing a gamified application to improve students' academic performance in mathematics, specifically trigonometry.",
    "keywords_cited": [
      "Aplicacion gamificada",
      "Video juego",
      "Jugabilidad"
    ]
  }
}