{
  "project_id": "2025S10",
  "model_id": "llama3.1:8b",
  "prompt_version": "v2",
  "input_hash": "bde267230743cda0c5ce7397",
  "input_source": "metadata_only",
  "generated_at": "2026-04-28T18:34:15+00:00",
  "verdict": {
    "primary_term": "Gamification",
    "secondary_term": null,
    "confidence": 0.9,
    "justification": "The project title and abstract clearly indicate the use of gamification as a primary object of study to support English language learning.",
    "keywords_cited": [
      "gamificación",
      "aprendizaje"
    ]
  }
}