{
  "project_id": "2017A2",
  "model_id": "qwen2.5:14b-instruct",
  "prompt_version": "v2",
  "input_hash": "31b59c7c7ff1b3d3ac6e37f5",
  "input_source": "metadata_only",
  "generated_at": "2026-04-26T15:17:21+00:00",
  "verdict": {
    "primary_term": "Serious games",
    "secondary_term": null,
    "confidence": 0.9,
    "justification": "The project develops a video game with mini-games to support English language teaching for engineering students, focusing on interactive and engaging learning methods.",
    "keywords_cited": [
      "Videojuegos",
      "Minijuegos",
      "Enseñanza del inglés"
    ]
  }
}