{
  "project_id": "2013B2",
  "model_id": "llama3.1:8b",
  "prompt_version": "v2",
  "input_hash": "226803a47e6cf8fcd6e68c26",
  "input_source": "metadata_only",
  "generated_at": "2026-04-26T16:35:48+00:00",
  "verdict": {
    "primary_term": "Enterprise information systems",
    "secondary_term": null,
    "confidence": 0.9,
    "justification": "The project aims to develop a software system for the management of undergraduate projects and anteprojects at Universidad del Valle Sede Tuluá, which is a specific organization.",
    "keywords_cited": [
      "Sistemas de información para la gestión",
      "Proyectos de grado",
      "Anteproyectos de grado"
    ]
  }
}