{
  "project_id": "2014A10",
  "model_id": "qwen2.5:14b-instruct",
  "prompt_version": "v2",
  "input_hash": "faf7b695df52bc54a265ba1b",
  "input_source": "metadata_only",
  "generated_at": "2026-04-26T15:11:34+00:00",
  "verdict": {
    "primary_term": "Web applications",
    "secondary_term": null,
    "confidence": 0.9,
    "justification": "The project focuses on developing a web application to support the quality management system of the Chamber of Commerce in Tuluá, addressing administrative and reporting needs.",
    "keywords_cited": [
      "Aplicaciones Web",
      "Sistema de Gestión de Calidad (SGC)",
      "Java (Lenguaje de programación)",
      "JavaScript (Lenguaje de Programacion)",
      "HTML (Lenguaje de procesamiento de texto)"
    ]
  }
}