{
  "project_id": "2025S20",
  "model_id": "mistral:7b-instruct",
  "prompt_version": "v2",
  "input_hash": "cb8c0b381225ee7a1269e0d4",
  "input_source": "metadata_only",
  "generated_at": "2026-04-28T18:35:57+00:00",
  "verdict": {
    "primary_term": "Recommender systems",
    "secondary_term": "Web applications",
    "confidence": 0.8,
    "justification": "The project focuses on developing a web application for implementing a clothing recommendation system based on the emotional well-being of the user through the integration of Behavioral Economics. The abstract mentions sentiment analysis and human-computer interaction, which are key aspects of web applications.",
    "keywords_cited": [
      "Clothing recommendation system",
      "Prototype web application",
      "Human computer interaction",
      "user interfaces",
      "Sentiment analysis"
    ]
  }
}