{
  "project_id": "2024S41",
  "model_id": "llama3.1:8b",
  "prompt_version": "v2",
  "input_hash": "72883055200f88d314e1229e",
  "input_source": "metadata_only",
  "generated_at": "2026-04-26T16:46:23+00:00",
  "verdict": {
    "primary_term": "Enterprise information systems",
    "secondary_term": null,
    "confidence": 0.9,
    "justification": "The project aims to develop a web tool for managing information in beauty salons, which is a specific industry with its own set of services and challenges. The focus on management and control of resources, customer relationships, and service history aligns with the characteristics of enterprise information systems.",
    "keywords_cited": [
      "sistemas de informacion",
      "belleza"
    ]
  }
}