{
  "project_id": "2024S39",
  "model_id": "qwen2.5:14b-instruct",
  "prompt_version": "v2",
  "input_hash": "e461f3ba22c0547e733638e7",
  "input_source": "metadata_only",
  "generated_at": "2026-04-25T17:30:20+00:00",
  "verdict": {
    "primary_term": "Cybersecurity",
    "secondary_term": null,
    "confidence": 0.9,
    "justification": "The project focuses on developing an audit software prototype for information protection in Windows 11, emphasizing user experience and compliance with international security standards.",
    "keywords_cited": [
      "Ciberseguridad",
      "privacidad de datos",
      "Cumplimiento normativo",
      "Analítica de seguridad"
    ]
  }
}