{
  "project_id": "2025S29",
  "model_id": "qwen2.5:14b-instruct",
  "prompt_version": "v2",
  "input_hash": "19c829c73d1789d76b82f3c6",
  "input_source": "metadata_only",
  "generated_at": "2026-04-25T17:28:13+00:00",
  "verdict": {
    "primary_term": "Web applications",
    "secondary_term": null,
    "confidence": 0.85,
    "justification": "The project focuses on redesigning and adapting the Invessoft system to a decoupled architecture, with an emphasis on developing the presentation layer using Angular, which is clearly a web application.",
    "keywords_cited": [
      "Web apps",
      "Vista arquitectural",
      "Usabilidad"
    ]
  }
}