{
  "project_id": "2015A7",
  "model_id": "mistral:7b-instruct",
  "prompt_version": "v2",
  "input_hash": "6f8b62c75f66b07706741460",
  "input_source": "metadata_only",
  "generated_at": "2026-04-26T16:50:29+00:00",
  "verdict": {
    "primary_term": "Enterprise information systems",
    "secondary_term": null,
    "confidence": 0.8,
    "justification": "The project title and keywords suggest a management application for a specific organization, the Acueducto Rural Ayacucho La Buitrera in Palmira.",
    "keywords_cited": [
      "Acueducto Rural Ayacucho La Buitrera",
      "gestión administrativa"
    ]
  }
}