{
  "project_id": "2016B7",
  "model_id": "mistral:7b-instruct",
  "prompt_version": "v2",
  "input_hash": "63fe1e2bf21e5a834a30571a",
  "input_source": "metadata_only",
  "generated_at": "2026-04-26T16:51:35+00:00",
  "verdict": {
    "primary_term": "E-learning",
    "secondary_term": null,
    "confidence": 0.8,
    "justification": "The project title and keywords suggest an e-learning application for primary school mathematics.",
    "keywords_cited": [
      "APLICACIÓN WEB",
      "ESTUDIO DEMATEMÁTICAS",
      "GRADO 5 DE PRIMARIA"
    ]
  }
}