{
  "project_id": "2024S08",
  "model_id": "llama3.1:8b",
  "prompt_version": "v2",
  "input_hash": "bdc4427a1b2d1f1870d94846",
  "input_source": "metadata_only",
  "generated_at": "2026-04-26T16:44:37+00:00",
  "verdict": {
    "primary_term": "Enterprise information systems",
    "secondary_term": null,
    "confidence": 0.9,
    "justification": "The project involves updating the Sistema Administrador de Giros (SAG) platform for CSI Consultores, which is a management application for a specific organization. The abstract mentions the importance of having an up-to-date information system to support organizational needs.",
    "keywords_cited": [
      "Sistema",
      "Organización"
    ]
  }
}