{
  "project_id": "2024S14",
  "model_id": "qwen2.5:14b-instruct",
  "prompt_version": "v2",
  "input_hash": "98266def1502214f4f2212f3",
  "input_source": "metadata_only",
  "generated_at": "2026-04-25T17:24:55+00:00",
  "verdict": {
    "primary_term": "Enterprise information systems",
    "secondary_term": "Mobile applications",
    "confidence": 0.8,
    "justification": "The project aims to implement a web application and a mobile app for the company Mecanizados Precisión Millán, focusing on process standardization and inventory management.",
    "keywords_cited": [
      "Sistemas de información",
      "Aplicación móvil",
      "sistemas",
      "tecnologia"
    ]
  }
}