{
  "project_id": "2015B5",
  "model_id": "llama3.1:8b",
  "prompt_version": "v2",
  "input_hash": "12bd2c13fbf14f0963d375e8",
  "input_source": "metadata_only",
  "generated_at": "2026-04-26T16:37:52+00:00",
  "verdict": {
    "primary_term": "Information systems",
    "secondary_term": null,
    "confidence": 0.9,
    "justification": "The project title mentions 'sistemas expertos', which implies a type of information system, and the focus on veterinary disease diagnosis suggests a specific application but not a novel web or mobile product.",
    "keywords_cited": [
      "expertos",
      "sistemas"
    ]
  }
}