{
  "project_id": "2016A6",
  "model_id": "qwen2.5:14b-instruct",
  "prompt_version": "v2",
  "input_hash": "d9fce4a70fc94f1632bf3c16",
  "input_source": "metadata_only",
  "generated_at": "2026-04-26T15:15:42+00:00",
  "verdict": {
    "primary_term": "Enterprise information systems",
    "secondary_term": null,
    "confidence": 0.9,
    "justification": "The project develops a web application for the UMATA unit in Trujillo, which automates processes and supports decision-making for users/beneficiaries. This fits well under enterprise information systems.",
    "keywords_cited": [
      "Aplicaciones Web",
      "Bases de datos",
      "Unidad Municipal de Asistencia Técnica Agropecuaria (UMATA)",
      "Toma de decisiones"
    ]
  }
}