{
  "project_id": "2013B6",
  "model_id": "mistral:7b-instruct",
  "prompt_version": "v2",
  "input_hash": "1c8ae9f72d9676c961a55f98",
  "input_source": "metadata_only",
  "generated_at": "2026-04-26T16:49:12+00:00",
  "verdict": {
    "primary_term": "Enterprise information systems",
    "secondary_term": null,
    "confidence": 0.85,
    "justification": "The project aims to develop a software application for the management of COFINCAFE, a cooperative savings and credit organization. The Balanced Scorecard system is used for strategic measurement and control, indicating an enterprise information system.",
    "keywords_cited": [
      "Desarrollo de software",
      "Software de aplicación",
      "Balanced scorecard (Gestión estratégica)",
      "Sistemas de gestión",
      "Cooperativa de ahorro y crédito Cafetera COFINCAFE"
    ]
  }
}