{
  "project_id": "2022S03",
  "model_id": "llama3.1:8b",
  "prompt_version": "v2",
  "input_hash": "69bc986e1fee04eb0c9d07a1",
  "input_source": "metadata_only",
  "generated_at": "2026-04-26T16:43:09+00:00",
  "verdict": {
    "primary_term": "Mobile applications",
    "secondary_term": null,
    "confidence": 0.9,
    "justification": "The project involves developing a mobile client for HeuristicTool, which is an application for evaluating the usability of interactive systems.",
    "keywords_cited": [
      "Interfaz de usuario",
      "Sistemas interactivos",
      "Android"
    ]
  }
}