{
  "project_id": "2024S25",
  "model_id": "mistral:7b-instruct",
  "prompt_version": "v2",
  "input_hash": "2bce0d88d41bdc8ee73e18ec",
  "input_source": "metadata_only",
  "generated_at": "2026-04-26T16:56:42+00:00",
  "verdict": {
    "primary_term": "Mobile applications",
    "secondary_term": null,
    "confidence": 0.7,
    "justification": "The project aims to develop a mobile app for managing inventory and orders in a club, which aligns with the definition of Mobile applications as the primary delivery channel is a native or hybrid mobile app.",
    "keywords_cited": [
      "Aplicación móvil",
      "framework"
    ]
  }
}