{
  "project_id": "2025S12",
  "model_id": "mistral:7b-instruct",
  "prompt_version": "v2",
  "input_hash": "79f1f5e7731a081d7247521b",
  "input_source": "metadata_only",
  "generated_at": "2026-04-28T18:35:37+00:00",
  "verdict": {
    "primary_term": "Web applications",
    "secondary_term": null,
    "confidence": 0.8,
    "justification": "The project involves the design and implementation of a web form builder for Truora's onboarding and identity validation process. The use of technologies like Go (Golang) for the backend and Vue.js 3, TypeScript, Flowbite, and Tailwind CSS for the frontend indicates that the primary focus is a web application.",
    "keywords_cited": [
      "Lenguaje Golang",
      "formulario web",
      "constructor digital"
    ]
  }
}